{
  "schemaVersion": "1.0",
  "messageId": "hdpe.states:3:88120",
  "tenantId": "0b5a6f3e-2d4c-4b8a-9e1f-7c6d5e4f3a2b",
  "connectionId": "9e8d7c6b-5a4f-4e3d-8c2b-1a0f9e8d7c6b",
  "sourceType": "kafka",
  "sourceObjectId": "unit100.run-state",
  "sourceRevision": "88120",
  "operation": "observe",
  "kind": "state",
  "observedAt": "2026-10-08T06:00:00.000Z",
  "receivedAt": "2026-10-08T06:00:01.100Z",
  "location": { "sourcePath": "HDPE/unit100" },
  "values": { "state": { "stateRef": "unit100.run-state", "value": "stopped", "previousValue": "running" } },
  "quality": { "status": "good" },
  "provenance": {
    "rawPayload": { "unit": "unit100", "state": "stopped" },
    "payloadHash": "sha256:7a9c1e3b5d7f9a1c3e5b7d9f1a3c5e7b9d1f3a5c7e9b1d3f5a7c9e1b3d5f7a9c",
    "mappingVersion": 2,
    "correlationId": "kafka:hdpe.states:3:88120"
  },
  "sourceControls": { "kafka": { "topic": "hdpe.states", "partition": 3, "offset": 88120, "key": "unit100" } }
}
